name,price,link
Dior Forever No-Transfer 24h Wear Matte Foundation podkład + Dior Forever Skin Correct 2N Neutral,"3,20",https://luxuryforless.pl/p/61/81783/dior-forever-no-transfer-24h-wear-matte-foundation-podklad-dior-forever-skin-correct-2n-neutral--twarz-podklady-pudry-roze-makijaz-.html
Dior Forever No-Transfer 24h Wear Matte Foundation podkład 2N Neutral,"2,80",https://luxuryforless.pl/p/61/81782/dior-forever-no-transfer-24h-wear-matte-foundation-podklad-2n-neutral-twarz-podklady-pudry-roze-makijaz-.html
Dior Diorshow Pump 'N' Volume 090 Black Mascara,"24,40",https://luxuryforless.pl/p/62/81781/dior-diorshow-pump-n-volume-090-black-mascara-oczy-tusze-cienie-kredki-makijaz-.html
Chanel Noir Allure Mascara 10 Noir,"31,92",https://luxuryforless.pl/p/62/81780/chanel-noir-allure-mascara-10-noir--oczy-tusze-cienie-kredki-makijaz-.html
Chanel Noir Allure Mascara 10 Noir,"15,92",https://luxuryforless.pl/p/62/81779/chanel-noir-allure-mascara-10-noir--oczy-tusze-cienie-kredki-makijaz-.html
Parfums de Marly Layton Exclusif woda perfumowana 125 ml,"804,00",https://luxuryforless.pl/p/23/81776/parfums-de-marly-layton-exclusif-woda-perfumowana-125-ml-dla-kobiet-.html
Parfums de Marly Layton woda perfumowana 125 ml,"677,60",https://luxuryforless.pl/p/55/81775/parfums-de-marly-layton-woda-perfumowana-125-ml-wyprzedaz-dla-kobiet-outlet.html
Parfums de Marly Kalan woda perfumowana 125 ml,"677,60",https://luxuryforless.pl/p/55/81774/parfums-de-marly-kalan-woda-perfumowana-125-ml-wyprzedaz-dla-kobiet-outlet.html
Chanel Le Volume Revolution Mascara tusz zapewniający maksymalną objętość rzęs,"15,92",https://luxuryforless.pl/p/62/81772/chanel-le-volume-revolution-mascara-tusz-zapewniajacy-maksymalna-objetosc-rzes-oczy-tusze-cienie-kredki-makijaz-.html
Chanel Les Beiges Healthy Glow Foundation B20 podkład,"4,00",https://luxuryforless.pl/p/61/81771/chanel-les-beiges-healthy-glow-foundation-b20-podklad-twarz-podklady-pudry-roze-makijaz-.html
Chanel Les Beiges Healthy Glow Sheer Powder B20 Naturelle,"12,40",https://luxuryforless.pl/p/61/81770/chanel-les-beiges-healthy-glow-sheer-powder-b20-naturelle-twarz-podklady-pudry-roze-makijaz-.html
Sisley L'Eau Rêvée D'Isa woda toaletowa 100 ml,"202,40",https://luxuryforless.pl/p/55/81769/sisley-l-eau-r-vee-d-isa-woda-toaletowa-100-ml-wyprzedaz-dla-kobiet-outlet.html
Signature Royale Oud Envoûtant woda perfumowana 50 ml,"117,60",https://luxuryforless.pl/p/27/81767/signature-royale-oud-envo-tant-woda-perfumowana-50-ml-perfumy-niszowe-dla-kobiet-.html
Prada Infusion d'Iris Cèdre woda perfumowana 100 ml,"292,00",https://luxuryforless.pl/p/55/81765/prada-infusion-d-iris-c-dre-woda-perfumowana-100-ml-wyprzedaz-dla-kobiet-outlet.html
Hermès Jour d'Hermes Absolu woda perfumowana 85 ml,"351,20",https://luxuryforless.pl/p/55/81755/herm-s-jour-d-hermes-absolu-woda-perfumowana-85-ml-wyprzedaz-dla-kobiet-outlet.html
Hermès Caleche Soie de Parfum woda perfumowana 100 ml,"246,80",https://luxuryforless.pl/p/55/81754/herm-s-caleche-soie-de-parfum-woda-perfumowana-100-ml-wyprzedaz-dla-kobiet-outlet.html
Hermès Eau de Mandarine Ambrée woda kolońska 100 ml,"188,80",https://luxuryforless.pl/p/55/81753/herm-s-eau-de-mandarine-ambree-woda-kolonska-100-ml-wyprzedaz-dla-kobiet-outlet.html
Hermès Concentré de Pamplemousse Rose woda toaletowa unisex 100 ml,"172,00",https://luxuryforless.pl/p/55/81752/herm-s-concentre-de-pamplemousse-rose-woda-toaletowa-unisex-100-ml-wyprzedaz-dla-kobiet-outlet.html
Pineider Bianco di Bulgaria woda perfumowana 100 ml,"592,00",https://luxuryforless.pl/p/23/81751/pineider-bianco-di-bulgaria-woda-perfumowana-100-ml-dla-kobiet-.html
Pineider Orchidea Reale woda perfumowana 100 ml,"592,00",https://luxuryforless.pl/p/27/81750/pineider-orchidea-reale-woda-perfumowana-100-ml-perfumy-niszowe-dla-kobiet-.html
Nayassia Matsya woda perfumowana 100 ml,"600,00",https://luxuryforless.pl/p/27/81748/nayassia-matsya-woda-perfumowana-100-ml-perfumy-niszowe-dla-kobiet-.html
Nayassia Farrukhnaz woda perfumowana 100 ml,"600,00",https://luxuryforless.pl/p/27/81747/nayassia-farrukhnaz-woda-perfumowana-100-ml-perfumy-niszowe-dla-kobiet-.html
Lattafa Ajayeb Dubai woda perfumowana 100 ml,"73,60",https://luxuryforless.pl/p/27/81746/lattafa-ajayeb-dubai-woda-perfumowana-100-ml-perfumy-niszowe-dla-kobiet-.html
Starck Peau de Lumière Magique woda perfumowana 90 ml,"192,80",https://luxuryforless.pl/p/27/81744/starck-peau-de-lumi-re-magique-woda-perfumowana-90-ml--perfumy-niszowe-dla-kobiet-.html
